{
  "case": {
    "analyzer": "eslint",
    "base_sha": "1111111111111111111111111111111111111111",
    "case_id": "FP-0001",
    "content_hash": "3b5d5c3712955042212316173ccf37be800b3d5f9e3ac61a2d6c1ea22ac0bbad",
    "created_at": "2026-10-30T09:00:00.000Z",
    "file": "packages/example/src/example.util.ts",
    "finding_id": "eslint:no-restricted-syntax:packages/example/src/example.util.ts:12",
    "head_sha": "2222222222222222222222222222222222222222",
    "pr": 1573,
    "rule": "no-restricted-syntax"
  },
  "outcome": "dismissed",
  "schema_version": 1,
  "verifiers": [
    {
      "agent_prompt_hash": "aa00000000000000000000000000000000000000000000000000000000000000",
      "cost_usd": 0.0421,
      "duration_ms": 18250,
      "evidence": "The flagged loop exits early on the first match, which the rule's own documentation allows.",
      "model": "claude-opus-5-5",
      "role": "judge",
      "tokens_in": 12400,
      "tokens_out": 820,
      "verdict": "FALSE_POSITIVE"
    },
    {
      "agent_prompt_hash": "aa00000000000000000000000000000000000000000000000000000000000000",
      "cost_usd": 0.0187,
      "duration_ms": 9400,
      "evidence": "Rewriting the loop as a chain would lose the early exit; the rule does not apply.",
      "model": "gpt-6",
      "role": "judge",
      "tokens_in": 11800,
      "tokens_out": 610,
      "verdict": "FALSE_POSITIVE"
    },
    {
      "agent_prompt_hash": "bb00000000000000000000000000000000000000000000000000000000000000",
      "cost_usd": null,
      "duration_ms": 22100,
      "evidence": "Looked for a variant of the code that satisfies the rule without losing behaviour and found none.",
      "model": "gemini-4-pro",
      "role": "adversary",
      "tokens_in": 13050,
      "tokens_out": 940,
      "verdict": "FALSE_POSITIVE"
    }
  ]
}
